{
  "schemaVersion": "1.1.0",
  "generatedAt": "2026-09-29T00:00:00Z",
  "counts": {
    "controls": 64,
    "pillars": 4,
    "by_pillar": {
      "1": 16,
      "2": 17,
      "3": 15,
      "4": 16
    },
    "by_tier": {
      "Baseline": 18,
      "Recommended": 33,
      "Regulated": 13
    },
    "by_pillar_tier": {
      "1": {
        "Baseline": 6,
        "Recommended": 7,
        "Regulated": 3
      },
      "2": {
        "Baseline": 6,
        "Recommended": 9,
        "Regulated": 2
      },
      "3": {
        "Baseline": 3,
        "Recommended": 6,
        "Regulated": 6
      },
      "4": {
        "Baseline": 3,
        "Recommended": 11,
        "Regulated": 2
      }
    },
    "playbooks_total": 272,
    "playbooks_control": 253,
    "playbooks_cross_cutting": 19,
    "solutions": 23
  },
  "controls": [
    {
      "id": "1.1",
      "pillar": 1,
      "tier": "Baseline",
      "title": "Control 1.1: Copilot Readiness Assessment and Data Hygiene",
      "path": "docs/controls/pillar-1-readiness/1.1-copilot-readiness-assessment.md",
      "last_verified": "2026-09-27",
      "regulatory_references": [
        "GLBA §501(b)",
        "FFIEC IT Handbook (Information Security Booklet)",
        "SR 11-7 / OCC Bulletin 2011-12",
        "OCC Bulletin 2023-17",
        "Sarbanes-Oxley §§302/404 (where applicable to ICFR)"
      ]
    },
    {
      "id": "1.2",
      "pillar": 1,
      "tier": "Baseline",
      "title": "Control 1.2: SharePoint Oversharing Detection and Remediation (DSPM for AI)",
      "path": "docs/controls/pillar-1-readiness/1.2-sharepoint-oversharing-detection.md",
      "last_verified": "2026-07-26",
      "regulatory_references": [
        "GLBA §501(b)",
        "SEC Regulation S-P (Rule 248.30)",
        "FFIEC IT Handbook (Information Security Booklet)"
      ]
    },
    {
      "id": "1.3",
      "pillar": 1,
      "tier": "Recommended",
      "title": "Control 1.3: Restricted SharePoint Search Configuration",
      "path": "docs/controls/pillar-1-readiness/1.3-restricted-sharepoint-search.md",
      "last_verified": "2026-08-18",
      "regulatory_references": [
        "GLBA §501(b)",
        "FFIEC IT Handbook (Information Security Booklet)",
        "Data Minimization Principles"
      ]
    },
    {
      "id": "1.4",
      "pillar": 1,
      "tier": "Recommended",
      "title": "Control 1.4: Semantic Index Governance and Scope Control",
      "path": "docs/controls/pillar-1-readiness/1.4-semantic-index-governance.md",
      "last_verified": "2026-07-26",
      "regulatory_references": [
        "GLBA §501(b)",
        "FFIEC IT Handbook (Information Security Booklet)",
        "Sarbanes-Oxley §§302/404 — where applicable to ICFR"
      ]
    },
    {
      "id": "1.5",
      "pillar": 1,
      "tier": "Baseline",
      "title": "Control 1.5: Sensitivity Label Taxonomy Review for Copilot",
      "path": "docs/controls/pillar-1-readiness/1.5-sensitivity-label-taxonomy-review.md",
      "last_verified": "2026-08-25",
      "regulatory_references": [
        "GLBA §501(b)",
        "Sarbanes-Oxley §§302/404 (where applicable to ICFR)",
        "FFIEC IT Handbook (Information Security Booklet)",
        "SEC Regulation S-P"
      ]
    },
    {
      "id": "1.6",
      "pillar": 1,
      "tier": "Baseline",
      "title": "Control 1.6: Permission Model Audit (SharePoint, OneDrive, Exchange, Teams, Graph)",
      "path": "docs/controls/pillar-1-readiness/1.6-permission-model-audit.md",
      "last_verified": "2026-09-24",
      "regulatory_references": [
        "GLBA §501(b)",
        "Sarbanes-Oxley §§302/404 (where applicable to ICFR)",
        "FFIEC IT Examination Handbook (Access Control)",
        "SEC Regulation S-P"
      ]
    },
    {
      "id": "1.7",
      "pillar": 1,
      "tier": "Recommended",
      "title": "Control 1.7: SharePoint Advanced Management Readiness for Copilot",
      "path": "docs/controls/pillar-1-readiness/1.7-sharepoint-advanced-management.md",
      "last_verified": "2026-09-24",
      "regulatory_references": [
        "GLBA §501(b)",
        "FFIEC IT Examination Handbook (Information Security Booklet)"
      ]
    },
    {
      "id": "1.8",
      "pillar": 1,
      "tier": "Recommended",
      "title": "Control 1.8: Information Architecture Review",
      "path": "docs/controls/pillar-1-readiness/1.8-information-architecture-review.md",
      "last_verified": "2026-09-24",
      "regulatory_references": [
        "GLBA §501(b)",
        "FFIEC IT Handbook (Information Security Booklet)",
        "Sarbanes-Oxley §§302/404 (where applicable to ICFR)"
      ]
    },
    {
      "id": "1.9",
      "pillar": 1,
      "tier": "Baseline",
      "title": "Control 1.9: License Planning and Copilot Assignment Strategy",
      "path": "docs/controls/pillar-1-readiness/1.9-license-planning.md",
      "last_verified": "2026-09-24",
      "regulatory_references": [
        "GLBA §501(b)",
        "FFIEC IT Handbook (IT Operations)",
        "Sarbanes-Oxley §§302/404 (where applicable to ICFR)"
      ]
    },
    {
      "id": "1.10",
      "pillar": 1,
      "tier": "Regulated",
      "title": "Control 1.10: Vendor Risk Management for Microsoft AI Services",
      "path": "docs/controls/pillar-1-readiness/1.10-vendor-risk-management.md",
      "last_verified": "2026-09-22",
      "regulatory_references": [
        "OCC Bulletin 2023-17",
        "Interagency Guidance on Third-Party Relationships (2023)",
        "FFIEC IT Handbook (Outsourcing Technology Services)",
        "GLBA §501(b)"
      ]
    },
    {
      "id": "1.11",
      "pillar": 1,
      "tier": "Recommended",
      "title": "Control 1.11: Organizational Change Management and Adoption Planning",
      "path": "docs/controls/pillar-1-readiness/1.11-change-management-adoption.md",
      "last_verified": "2026-09-27",
      "regulatory_references": [
        "FFIEC IT Handbook (Management)",
        "12 CFR part 30",
        "appendix D (OCC Heightened Standards)"
      ]
    },
    {
      "id": "1.12",
      "pillar": 1,
      "tier": "Baseline",
      "title": "Control 1.12: Training and Awareness Program",
      "path": "docs/controls/pillar-1-readiness/1.12-training-awareness.md",
      "last_verified": "2026-09-27",
      "regulatory_references": [
        "FINRA Rule 3110",
        "FFIEC IT Handbook (Information Security Booklet)",
        "GLBA §501(b)"
      ]
    },
    {
      "id": "1.13",
      "pillar": 1,
      "tier": "Regulated",
      "title": "Control 1.13: Extensibility Readiness (Copilot Connectors, Plugins, Declarative Agents)",
      "path": "docs/controls/pillar-1-readiness/1.13-extensibility-readiness.md",
      "last_verified": "2026-07-26",
      "regulatory_references": [
        "GLBA §501(b)",
        "FFIEC IT Handbook (Information Security Booklet)",
        "OCC Bulletin 2023-17 (Third-Party Relationships)"
      ]
    },
    {
      "id": "1.14",
      "pillar": 1,
      "tier": "Recommended",
      "title": "Control 1.14: Item-Level Permission Scanning",
      "path": "docs/controls/pillar-1-readiness/1.14-item-level-permission-scanning.md",
      "last_verified": "2026-07-26",
      "regulatory_references": [
        "GLBA §501(b)",
        "SEC Rule 17a-4",
        "FFIEC IT Handbook (Access Controls)",
        "NIST SP 800-53 (AC-3, AC-6, AU-2)"
      ]
    },
    {
      "id": "1.15",
      "pillar": 1,
      "tier": "Recommended",
      "title": "Control 1.15: SharePoint Permissions Drift Detection",
      "path": "docs/controls/pillar-1-readiness/1.15-sharepoint-permissions-drift.md",
      "last_verified": "2026-07-26",
      "regulatory_references": [
        "GLBA §501(b)",
        "SEC Rule 17a-4",
        "SEC Rule 17a-4(f)",
        "FFIEC IT Handbook (Access Controls, Change Management)",
        "NIST SP 800-53 (CM-3, SI-7, AC-6)"
      ]
    },
    {
      "id": "1.16",
      "pillar": 1,
      "tier": "Regulated",
      "title": "Control 1.16: Copilot Tuning Governance",
      "path": "docs/controls/pillar-1-readiness/1.16-copilot-tuning-governance.md",
      "last_verified": "2026-09-22",
      "regulatory_references": [
        "GLBA §501(b)",
        "SR 11-7 / OCC Bulletin 2011-12 (interim — applicable to genAI per the 2026-13 exclusion)",
        "Interagency RFI on AI (2023)"
      ]
    },
    {
      "id": "2.1",
      "pillar": 2,
      "tier": "Baseline",
      "title": "Control 2.1: DLP Policies for Microsoft 365 Copilot Interactions",
      "path": "docs/controls/pillar-2-security/2.1-dlp-policies-for-copilot.md",
      "last_verified": "2026-09-22",
      "regulatory_references": [
        "FINRA 4511",
        "SEC Reg S-P",
        "GLBA §501(b)",
        "Sarbanes-Oxley §§302/404"
      ]
    },
    {
      "id": "2.2",
      "pillar": 2,
      "tier": "Baseline",
      "title": "Control 2.2: Sensitivity Labels and Copilot Content Classification",
      "path": "docs/controls/pillar-2-security/2.2-sensitivity-labels-classification.md",
      "last_verified": "2026-08-25",
      "regulatory_references": [
        "GLBA §501(b)",
        "Sarbanes-Oxley §§302/404"
      ]
    },
    {
      "id": "2.3",
      "pillar": 2,
      "tier": "Baseline",
      "title": "Control 2.3: Conditional Access Policies for Copilot Workloads",
      "path": "docs/controls/pillar-2-security/2.3-conditional-access-policies.md",
      "last_verified": "2026-09-24",
      "regulatory_references": [
        "GLBA §501(b)",
        "NYDFS Part 500",
        "FFIEC"
      ]
    },
    {
      "id": "2.4",
      "pillar": 2,
      "tier": "Regulated",
      "title": "Control 2.4: Information Barriers for Copilot (Chinese Wall)",
      "path": "docs/controls/pillar-2-security/2.4-information-barriers.md",
      "last_verified": "2026-09-24",
      "regulatory_references": [
        "SEC Rule 10b-5",
        "FINRA 5280",
        "Chinese Wall Requirements"
      ]
    },
    {
      "id": "2.5",
      "pillar": 2,